type,title,authors,journal,abstract,year,doi,volume,issue,pages,article_number,keywords
article,Determination of water balance maintenance in<i> Orcinus orca</i> and <i>Tursios truncatus</i> using oxygen isotopes,"Seon, Nicolas and Brasseur, Isabelle and Scala, Christopher and Tacail, Theo and Catteau, Sidonie and Fourel, Francois and Vincent, Peggy and Lecuyer, Christophe and Suan, Guillaume and Charbonnier, Sylvain and Vincon-Laugier, Arnauld and Amiot, Romain",JOURNAL OF EXPERIMENTAL BIOLOGY,"The secondary adaptation of Cetacea to a fully marine lifestyle raises the question of their ability to maintain their water balance in a hyperosmotic environment. Cetacea have access to four potential sources of water: surrounding salt oceanic water, dietary free water, metabolic water and inhaled water vapour to a lesser degree. Here, we measured the O-18/O-16 oxygen isotope ratio of blood plasma from 13 specimens belonging to two species of Cetacea raised under human care (four killer whales Orcinus orca, nine common bottlenose dolphins Tursiops truncatus) to investigate and quantify the contribution of preformed water (dietary free water, surrounding salt oceanic water) and metabolic water to Cetacea body water using a box-modelling approach. The oxygen isotope composition of Cetacea blood plasma indicates that dietary free water and metabolic water contribute to more than 90\% of the total water input in weight for cetaceans, with the remaining 10\% consisting of inhaled water vapour and surrounding water accidentally ingested or absorbed through the skin. Moreover, the contribution of metabolic water appears to be more important in organisms with a more lipid-rich diet. Beyond these physiological and conservation biology implications, this study opens up questions that need to be addressed, such as the applicability of the oxygen isotope composition of cetacean body fluids and skeletal elements as an environmental proxy of the oxygen isotope composition of present and past marine waters.",2023,10.1242/jeb.245648,226,23,NA,jeb245648,Body water; Cetacea; Common bottlenose dolphin; Killer whale; Oxygen isotopes
article,Experimental manipulations of tissue oxygen supply do not affect warming tolerance of European perch,"Brijs, Jeroen and Jutfelt, Fredrik and Clark, Timothy D. and Grans, Albin and Ekstrom, Andreas and Sandblom, Erik",JOURNAL OF EXPERIMENTAL BIOLOGY,"A progressive inability of the cardiorespiratory system to maintain systemic oxygen supply at elevated temperatures has been suggested to reduce aerobic scope and the upper thermal limit of aquatic ectotherms. However, few studies have directly investigated the dependence of thermal limits on oxygen transport capacity. By manipulating oxygen availability (via environmental hyperoxia) and blood oxygen carrying capacity (via experimentally induced anaemia) in European perch (Perca fluviatilis Linneaus), we investigated the effects of oxygen transport capacity on aerobic scope and the critical thermal maximum (CTmax). Hyperoxia resulted in a twofold increase in aerobic scope at the control temperature of 23 degrees C, but this did not translate to an elevated CTmax in comparison with control fish (34.6 +/- 0.1 versus 34.0 +/- 0.5 degrees C, respectively). Anaemia (similar to 43\% reduction in haemoglobin concentration) did not cause a reduction in aerobic scope or CTmax (33.8 +/- 0.3 degrees C) compared with control fish. Additionally, oxygen consumption rates of anaemic perch during thermal ramping increased in a similar exponential manner to that in control fish, highlighting that perch have an impressive capacity to compensate for a substantial reduction in blood oxygen carrying capacity. Taken together, these results indicate that oxygen limitation is not a universal mechanism determining the CTmax of fishes.",2015,10.1242/jeb.121889,218,15,2448-2454,NA,Metabolism; Oxygen consumption; Aerobic scope; Hyperoxia; Anaemia; Temperature
article,Spectral sensitivity of cone vision in the diurnal murid <i>Rhabdomys pumilio</i>,"Allen, Annette E. and Mouland, Josh W. and Rodgers, Jessica and Bano-Otalora, Beatriz and Douglas, Ronald H. and Jeffery, Glen and Vugler, Anthony A. and Brown, Timothy M. and Lucas, Robert J.",JOURNAL OF EXPERIMENTAL BIOLOGY,"An animal's temporal niche - the time of day at which it is active - is known to drive a variety of adaptations in the visual system. These include variations in the topography, spectral sensitivity and density of retinal photoreceptors, and changes in the eye's gross anatomy and spectral transmission characteristics. We have characterised visual spectral sensitivity in the murid rodent Rhabdomys pumilio (the fourstriped grass mouse), which is in the same family as (nocturnal) mice and rats but exhibits a strong diurnal niche. As is common in diurnal species, the R. pumilio lens acts as a long-pass spectral filter, providing limited transmission of light <400 nm. Conversely, we found strong sequence homologies with the R. pumilio SWS and MWS opsins and those of related nocturnal species (mice and rats) whose SWS opsins are maximally sensitive in the near-UV. We continued to assess in vivo spectral sensitivity of cone vision using electroretinography and multi-channel recordings from the visual thalamus. These revealed that responses across the human visible range could be adequately described by those of a single pigment (assumed to be MWSopsin) maximally sensitive at similar to 500 nm, but that sensitivity in the near-UV required inclusion of a second pigment whose peak sensitivity lay well into the UV range (lambda(max)<400 nm, probably similar to 360 nm). We therefore conclude that, despite the UV-filtering effects of the lens, R. pumilio retains an SWS pigment with a UV-A lambda(max). In effect, this somewhat paradoxical combination of longpass lens and UV-A lambda(max) results in narrow-band sensitivity for SWS cone pathways in the UV-A range.",2020,10.1242/jeb.215368,223,11,NA,jeb215368,Diurnality; Photoreceptor; Opsin
article,Ultraviolet sensitivity and colour vision in raptor foraging,"Lind, Olle and Mitkus, Mindaugas and Olsson, Peter and Kelber, Almut",JOURNAL OF EXPERIMENTAL BIOLOGY,"Raptors have excellent vision, yet it is unclear how they use colour information. It has been suggested that raptors use ultraviolet (UV) reflections from vole urine to find good hunting grounds. In contrast, UV plumage colours in songbirds such as blue tits are assumed to be `hidden' communication signals, inconspicuous to raptors. This ambiguity results from a lack of knowledge about raptor ocular media transmittance, which sets the limit for UV sensitivity. We measured ocular media transmittance in common buzzards (Buteo buteo), sparrowhawks (Accipiter nisus), red kites (Milvus milvus) and kestrels (Falco tinnunculus) so that, for the first time, raptor UV sensitivity can be fully described. With this information, and new measurements of vole urine reflectance, we show that (i) vole urine is unlikely to provide a reliable visual signal to hunting raptors and (ii) blue tit plumage colours are more contrasting to blue tits than to sparrowhawks because of UV reflectance. However, as the difference between blue tit and sparrowhawk vision is subtle, we suggest that behavioural data are needed to fully resolve this issue. UV cues are of little or no importance to raptors in both vole and songbird interactions and the role of colour vision in raptor foraging remains unclear.",2013,10.1242/jeb.082834,216,10,1819-1826,NA,ultraviolet reflectance; ocular media transmittance; bird vision; raptor hunting behaviour; visual modelling; vole urine
article,Desiccation tolerance in <i>Anopheles coluzzii</i>: the effects of spiracle size and cuticular hydrocarbons,"Arcaz, Arthur C. and Huestis, Diana L. and Dao, Adama and Yaro, Alpha S. and Diallo, Moussa and Andersen, John and Blomquist, Gary J. and Lehmann, Tovi",JOURNAL OF EXPERIMENTAL BIOLOGY,"The African malaria mosquitoes Anopheles gambiae and Anopheles coluzzii range over forests and arid areas, where they withstand dry spells and months-long dry seasons, suggesting variation in their desiccation tolerance. We subjected a laboratory colony (G3) and wild Sahelian mosquitoes during the rainy and dry seasons to desiccation assays. The thoracic spiracles and amount and composition of cuticular hydrocarbons (CHCs) of individual mosquitoes were measured to determine the effects of these traits on desiccation tolerance. The relative humidity of the assay, body water available, rate of water loss and water content at death accounted for 88\% of the variation in desiccation tolerance. Spiracle size did not affect the rate of water loss or desiccation tolerance of the colony mosquitoes, as was the case for the total CHCs. However, six CHCs accounted for 71\% of the variation in desiccation tolerance and three accounted for 72\% of the variation in the rate of water loss. Wild A. coluzzii exhibited elevated desiccation tolerance during the dry season. During that time, relative thorax and spiracle sizes were smaller than during the rainy season. A smaller spiracle size appeared to increase A. coluzzii's desiccation tolerance, but was not statistically significant. Seasonal changes in CHC composition were detected in Sahelian A. coluzzii. Stepwise regression models suggested the effect of particular CHCs on desiccation tolerance. In conclusion, the combination of particular CHCs along with the total amount of CHCs is a primary mechanism conferring desiccation tolerance in A. coluzzii, while variation in spiracle size might be a secondary mechanism.",2016,10.1242/jeb.135665,219,11,1675-1688,NA,Mosquito; Aestivation; Anopheles gambiae; Desiccation resistance; Water balance; Dry season
article,Skeletal muscle metabolism in sea-acclimatized king penguins. I. Thermogenic mechanisms,"Roussel, Damien and Le Coadic, Marion and Rouanet, Jean-Louis and Duchamp, Claude",JOURNAL OF EXPERIMENTAL BIOLOGY,"At fledging, king penguin juveniles undergo a major energetic challenge to overcome the intense and prolonged energy demands for thermoregulation and locomotion imposed by life in cold seas. Among other responses, sea acclimatization triggers fuel selection in skeletal muscle metabolism towards lipid oxidation in vitro, which is reflected by a drastic increase in lipid-induced thermogenesis in vivo. However, the exact nature of skeletal muscle thermogenic mechanisms (shivering and/or non-shivering thermogenesis) remains undefined. The aim of the present study was to determine in vivo whether the capacity for non-shivering thermogenesis was enhanced by sea acclimatization. We measured body temperature, metabolic rate, heart rate and shivering activity in fully immersed king penguins (Aptenodytes patagonicus) exposed to water temperatures ranging from 12 to 29 degrees C. Results from terrestrial pre-fledging juveniles were compared with those from sea-acclimatized immature penguins (hereafter `immatures'). The capacity for thermogenesis in water was as effective in juveniles as in immatures, while the capacity for nonshivering thermogenesis was not reinforced by sea acclimatization. This result suggests that king penguins mainly rely on skeletal muscle contraction (shivering or locomotor activity) to maintain endothermy at sea. Sea-acclimatized immature penguins also exhibited higher shivering efficiency and oxygen pulse (amount of oxygen consumed or energy expended per heartbeat) than pre-fledging juvenile birds. Such increase in shivering and cardiovascular efficiency may favor a more efficient activity-thermoregulatory heat substitution providing penguins with the aptitude to survive the tremendous energetic challenge imposed by marine life in cold circumpolar oceans.",2020,10.1242/jeb.233668,223,21,NA,jeb233668,Endothermy; Marine birds; Metabolic rate; Non-shivering thermogenesis; Shivering
article,Arginine and proline applied as food additives stimulate high freeze tolerance in larvae of <i>Drosophila</i> <i>melanogaster</i>,"Kostal, Vladimir and Korbelova, Jaroslava and Poupardin, Rodolphe and Moos, Martin and Simek, Petrs",JOURNAL OF EXPERIMENTAL BIOLOGY,"The fruit fly Drosophila melanogaster is an insect of tropical origin. Its larval stage is evolutionarily adapted for rapid growth and development under warm conditions and shows high sensitivity to cold. In this study, we further developed an optimal acclimation and freezing protocol that significantly improves larval freeze tolerance (an ability to survive at -5 degrees C when most of the freezable fraction of water is converted to ice). Using the optimal protocol, freeze survival to adult stage increased from 0.7\% to 12.6\% in the larvae fed standard diet (agar, sugar, yeast, cornmeal). Next, we fed the larvae diets augmented with 31 different amino compounds, administered in different concentrations, and observed their effects on larval metabolomic composition, viability, rate of development and freeze tolerance. While some diet additives were toxic, others showed positive effects on freeze tolerance. Statistical correlation revealed tight association between high freeze tolerance and high levels of amino compounds involved in arginine and proline metabolism. Proline-and arginine-augmented diets showed the highest potential, improving freeze survival to 42.1\% and 50.6\%, respectively. Two plausible mechanisms by which high concentrations of proline and arginine might stimulate high freeze tolerance are discussed: (i) proline, probably in combination with trehalose, could reduce partial unfolding of proteins and prevent membrane fusions in the larvae exposed to thermal stress (prior to freezing) or during freeze dehydration; (ii) both arginine and proline are exceptional among amino compounds in their ability to form supramolecular aggregates which probably bind partially unfolded proteins and inhibit their aggregation under increasing freeze dehydration.",2016,10.1242/jeb.142158,219,15,2358-2367,NA,Fruit fly; Diet augmentation; Cold tolerance; Metabolomics; Cryoprotectant; Compatible solute; Preferential exclusion; Protein aggregation
article,Bearded dragons (<i>Pogona</i> <i>vitticeps</i>) with reduced scalation lose water faster but do not have substantially different thermal preferences,"Sakich, Nicholas B. and Tattersall, Glenn J.",JOURNAL OF EXPERIMENTAL BIOLOGY,"Whether scales reduce cutaneous evaporative water loss in lepidosaur reptiles (Superorder Lepidosauria) such as lizards and snakes has been a contentious issue for nearly half a century. Furthermore, while many studies have looked at whether dehydration affects thermal preference in lepidosaurs, far fewer have examined whether normally hydrated lepidosaurs can assess their instantaneous rate of evaporative water loss and adjust their thermal preference to compensate in an adaptive manner. We tested both of these hypotheses using three captive-bred phenotypes of bearded dragon (Pogona vitticeps) sourced from the pet trade: `wild-types' with normal scalation, `leatherbacks' exhibiting scales of reduced prominence, and scaleless bearded dragons referred to as `silkbacks'. Silkbacks on average lost water evaporatively at about twice the rate that wild-types did. Leatherbacks on average were closer in their rates of evaporative water loss to silkbacks than they were to wild-types. Additionally, very small (at most similar to 1 degrees C) differences in thermal preference existed between the three phenotypes thatwere not statistically significant. This suggests a lack of plasticity in thermal preference in response to an increase in the rate of evaporative water loss, and may be reflective of a thermal `strategy' as employed by thermoregulating bearded dragons that prioritises immediate thermal benefits over the threat of future dehydration. The results of this study bolster an often-discounted hypothesis regarding the present adaptive function of scales and have implications for the applied fields of animal welfare and conservation.",2021,10.1242/jeb.234427,224,12,NA,jeb234427,Lepidosauria; Squamata; Reptile; Water; Temperature; Scale
article,Effects of elevated <i>p</i>CO<sub>2</sub> and feeding on net calcification and energy budget of the Mediterranean cold-water coral <i>Madrepora oculata</i>,"Maier, Cornelia and Popp, Pauline and Sollfrank, Nicole and Weinbauer, Markus G. and Wild, Christian and Gattuso, Jean-Pierre",JOURNAL OF EXPERIMENTAL BIOLOGY,"Ocean acidification is a major threat to calcifying marine organisms such as deep-sea cold-water corals (CWCs), but related knowledge is scarce. The aragonite saturation threshold (Omega(a)) for calcification, respiration and organic matter fluxes were investigated experimentally in the Mediterranean Madrepora oculata. Over 10 weeks, colonies were maintained under two feeding regimes (uptake of 36.75 and 7.46 mu mol C polyp(-1) week(-1)) and exposed in 2 week intervals to a consecutively changing air-CO2 mix (pCO(2)) of 400, 1600, 800, 2000 and 400 ppm. There was a significant effect of feeding on calcification at initial ambient pCO(2), while with consecutive pCO(2) treatments, feeding had no effect on calcification. Respiration was not significantly affected by feeding or pCO(2) levels. Coral skeletons started to dissolve at an average Omega(a) threshold of 0.92, but recovered and started to calcify again at Omega(a)>= 1. The surplus energy required to counteract dissolution at elevated pCO2 (>= 1600 mu atm) was twice that at ambient pCO(2). Yet, feeding had no mitigating effect at increasing pCO(2) levels. This could be due to the fact that the energy required for calcification is a small fraction (1-3\%) of the total metabolic energy demand and corals even under low food conditions might therefore still be able to allocate this small portion of energy to calcification. The response and resistance to ocean acidification are consequently not controlled by feeding in this species, but more likely by chemical reactions at the site of calcification and exchange processes between the calicoblastic layer and ambient seawater.",2016,10.1242/jeb.127159,219,20,3208-3217,NA,Scleractinia; Mediterranean Sea; Deep sea; Metabolic energy; Ocean acidification
article,Effects of chronic exposure to 12parts per thousand saltwater on the endocrine physiology of juvenile American alligator (<i>Alligator mississippiensis</i>),"Faulkner, P. C. and Burleson, M. L. and Simonitis, L. and Marshall, C. D. and Hala, D. and Petersen, L. H.",JOURNAL OF EXPERIMENTAL BIOLOGY,"American alligator (Alligator mississippiensis) habitats are prone to saltwater intrusion following major storms, hurricanes or droughts. Anthropogenic impacts affecting hydrology of freshwater systems may exacerbate saltwater intrusion into freshwater habitats. The endocrine system of alligators is susceptible to changes in the environment but it is currently not known how the crocodilian physiological system responds to environmental stressors such as salinity. Juvenile alligators were exposed to 12\%o saltwater for 5 weeks to determine the effects of chronic exposure to saline environments. Following 5 weeks, plasma levels of hormones {[}e.g. progesterone, testosterone, estradiol, corticosterone, aldosterone (ALDO), angiotensin II (ANG II)] were quantified using liquid chromatography and tandem mass spectrometry. Compared with freshwater-kept subjects, saltwater-exposed alligators had significantly elevated plasma levels of corticosterone, 11-deoxycortisol, 17 alpha-hydroxyprogesterone, testosterone, 17 beta-estradiol, estrone and estriol whereas pregnenolone and ANG II were significantly depressed and ALDO levels were unchanged (slightly depressed). On the one hand, saltwater exposure did not affect gene expression of renal mineralocorticoid and glucorticoid and angiotensin type 1 (AT-1) receptors or morphology of lingual glands. On the other hand, saltwater exposure significantly reduced plasma glucose concentrations whereas parameters diagnostic of perturbed liver function (aspartate aminotransferase and alanine aminotransferase) and kidney function (creatinine and creatine kinase) were significantly elevated. Except for plasma potassium levels (K+), plasma ions Na+ and Cl(- )were significantly elevated in saltwater alligators. Overall, this study demonstrated significant endocrine and physiological effects in juvenile alligators chronically exposed to a saline environment. Results provide novel insights into the effects of a natural environmental stressor (salinity) on the renin-angiotensin-aldosterone system and steroidogenesis of alligators.",2018,10.1242/jeb.181172,221,14,NA,NA,RAAS; Steroidogenesis; Plasma biochemistry; Angiotensin II; Aldosterone; Saltwater stress
article,"Effect of water temperature on diel feeding, locomotion behaviour and digestive physiology in the sea cucumber <i>Apostichopus japonicus</i>","Sun, Jiamin and Zhang, Libin and Pan, Yang and Lin, Chenggang and Wang, Fang and Yang, Hongsheng",JOURNAL OF EXPERIMENTAL BIOLOGY,"This study used controlled laboratory conditions to directly assess the role of water temperature in controlling diel feeding and locomotion behaviours, and digestive physiology, in the sea cucumber Apostichopus japonicus. The results revealed that both the proportion of feeding individuals and ingestion rate were highest at 16 degrees C. Regardless of water temperature, sea cucumbers appeared to be nocturnal and their peak feeding activity occurred at 00:00 h to 04:00 h. Tentacle insertion rate was not significantly correlated with water temperature (<24 degrees C). In all temperature treatments except 24 degrees C, the proportion of moving sea cucumbers was also observed to be higher at night than during the day. The water temperature above thermal threshold (24 degrees C) for aestivation may alter the diel locomotion rhythm. The highest lipase and amylase activities were both observed at 20 degrees C. The highest activities of lipase and amylase at all temperature treatments were observed at 22:00 h to 02:00 h, which was slightly earlier than the feeding peak. In conclusion, even in total darkness, A. japonicus showed more active feeding and moving activities, and higher digestive enzyme activities, at night than during the day. These results demonstrated that diel feeding and locomotion behaviours, at least in the short term, were not controlled by light or low water temperature (<24 degrees C) but by an endogenous rhythm, and A. japonicus had the ability to optimize the digestive function for the coming feeding peak. These findings should provide valuable information for the development of the aquaculture of this species.",2018,10.1242/jeb.177451,221,9,NA,jeb177451,Apostichopus japonicus; Water temperature; Feeding; Locomotion; Digestive enzyme
article,Rh versus pH: the role of Rhesus glycoproteins in renal ammonia excretion during metabolic acidosis in a freshwater teleost fish,"Wright, Patricia A. and Wood, Chris M. and Wilson, Jonathan M.",JOURNAL OF EXPERIMENTAL BIOLOGY,"Increased renal ammonia excretion in response to metabolic acidosis is thought to be a conserved response in vertebrates. We tested the hypothesis that Rhesus (Rh) glycoproteins in the kidney of the freshwater common carp, Cyprinus carpio, play a crucial role in regulating renal ammonia excretion during chronic metabolic acidosis. Exposure to water pH 4.0 (72 h) resulted in a classic metabolic acidosis with reduced plasma arterial pH and {[}HCO3-], no change in PCO2 and large changes in renal function. Urine {[}NH4+] as well as {[}titratable acidity-HCO3-] rose significantly over the acid exposure, but the profound reduction (fivefold) in urine flow rates eliminated the expected elevations in renal ammonia excretion. Low urine flow rates may be a primary strategy to conserve ions, as urinary excretion rates of Na+, Cl- and Ca2+ were significantly lower during the acid exposure relative to the control period. Interestingly, renal Rhcg1 mRNA and protein levels were elevated in acid-exposed relative to control groups, along with mRNA levels of several ion transporters, including the Na+/H+ exchanger, H+-ATPase and Na+/K+-ATPase. Immunofluorescence microscopy showed a strong apical Rhcg1 signal in distal tubules. Taken together, these data show that renal Rh glycoproteins and associated ion transporters are responsive to metabolic acidosis, but conservation of ions through reduced urine flow rates takes primacy over renal acid-base regulation in the freshwater C. carpio. We propose that an `acid/base-ion balance' compromise explains the variable renal responses to metabolic acidosis in freshwater teleosts.",2014,10.1242/jeb.098640,217,16,2855-2865,NA,Carp; Cyprinus carpio; Kidney; Acid-base regulation; Ion regulation
