type,title,authors,journal,abstract,year,doi,volume,issue,pages,article_number,keywords
article,Fluctuating environments during early development can limit adult phenotypic flexibility: insights from an amphibious fish,"Rossi, Giulia S. and Cochrane, V, Paige and Wright, Patricia A.",JOURNAL OF EXPERIMENTAL BIOLOGY,"The interaction between developmental plasticity and the capacity for reversible acclimation (phenotypic flexibility) is poorly understood, particularly in organisms exposed to fluctuating environments. We used an amphibious killifish (Kryptolebias marmoratus) to test the hypotheses that organisms reared in fluctuating environments (i) will make no developmental changes to suit any one environment because fixing traits to suit one environment could be maladaptive for another, and (ii) will be highly phenotypically flexible as adults because their early life experiences predict high environmental variability in the future. We reared fish under constant (water) or fluctuating (water-air) environments until adulthood and assessed a suite of traits along the oxygen cascade (e.g. neuroepithelial cell density and size, cutaneous capillarity, gill morphology, ventricle size, red muscle morphometrics, terrestrial locomotor performance). To evaluate the capacity for phenotypic flexibility, a subset of adult fish from each rearing condition was then air-exposed for 14 days before the same traits were measured. In support of the developmental plasticity hypothesis, traits involved with O-2 sensing and uptake were largely unaffected by water-air fluctuations during early life, but we found marked developmental changes in traits related to O-2 transport, utilization and locomotor performance. In contrast, we found no evidence supporting the phenotypic flexibility hypothesis. Adult fish from both rearing conditions exhibited the same degree of phenotypic flexibility in various O-2 sensing- and uptake-related traits. In other cases, water-air fluctuations attenuated adult phenotypic flexibility despite the fact that phenotypic flexibility is hypothesized to be favoured when environments fluctuate. Overall, we condude that exposure to environmental fluctuations during development in K. marmoratus can dramatically alter the constitutive adult phenotype, as well as diminish the scope for phenotypic flexibility in later life.",2020,10.1242/jeb.228304,223,16,NA,jeb228304,Acclimation; Gill lamellae; Heart size; Locomotor performance; Neuroepithelial cells; Oxygen cascade; Phenotypic plasticity; Skeletal muscle
article,Shaving increases daily energy expenditure in free-living root voles,"Szafranska, Paulina A. and Zub, Karol and Wieczorek, Monika and Ksiazek, Aneta and Speakman, John R. and Konarzewski, Marek",JOURNAL OF EXPERIMENTAL BIOLOGY,"Experimental manipulation of energy expenditure has long been recognized as an effective means for identifying causative effects and avoiding confounded interpretations arising from spurious correlations. This approach has been successfully applied mainly to studies on birds, particularly on reproducing adults, whereas manipulations in mammals have proved more problematic. Here, we tested the hypothesis that shaving off 50\% of the dorsal pelage should effectively increase energy expenditure in wild root voles (Microtus oeconomus) in their natural environment. We measured daily energy expenditure (DEE), using doubly labelled water in shaved and unshaved voles at the beginning of winter. The difference in DEE (corrected for body mass and year effects) between experimental and control group fluctuated from 11.5\% to 17.3\%. Probability of recapture over the 3 day DEE assay was strongly dependent on body mass, but did not differ between shaved and unshaved animals; however, a prevalence of larger (heavier) shaved individuals was observed. Shaved animals lost more weight between the first and second trapping. Shaving therefore appears to be an effective method of increasing the cost of total DEE in wild endotherms in their natural environment.",2014,10.1242/jeb.103754,217,22,3964-3967,NA,Body mass; Doubly labelled water; Fur insulation; Mammal; Metabolic rate; Thermoregulation
article,Metabolic costs imposed by hydrostatic pressure constrain bathymetric range in the lithodid crab <i>Lithodes maja</i>,"Brown, Alastair and Thatje, Sven and Morris, James P. and Oliphant, Andrew and Morgan, Elizabeth A. and Hauton, Chris and Jones, Daniel O. B. and Pond, David W.",JOURNAL OF EXPERIMENTAL BIOLOGY,"The changing climate is shifting the distributions of marine species, yet the potential for shifts in depth distributions is virtually unexplored. Hydrostatic pressure is proposed to contribute to a physiological bottleneck constraining depth range extension in shallow-water taxa. However, bathymetric limitation by hydrostatic pressure remains undemonstrated, and the mechanism limiting hyperbaric tolerance remains hypothetical. Here, we assess the effects of hydrostatic pressure in the lithodid crab Lithodes maja (bathymetric range 4-790 m depth, approximately equivalent to 0.1 to 7.9 MPa hydrostatic pressure). Heart rate decreased with increasing hydrostatic pressure, and was significantly lower at >= 10.0 MPa than at 0.1 MPa. Oxygen consumption increased with increasing hydrostatic pressure to 12.5 MPa, before decreasing as hydrostatic pressure increased to 20.0 MPa; oxygen consumption was significantly higher at 7.5-17.5 MPa than at 0.1 MPa. Increases in expression of genes associated with neurotransmission, metabolism and stress were observed between 7.5 and 12.5 MPa. We suggest that hyperbaric tolerance in L. maja may be oxygen-limited by hyperbaric effects on heart rate and metabolic rate, but that L. maja's bathymetric range is limited by metabolic costs imposed by the effects of high hydrostatic pressure. These results advocate including hydrostatic pressure in a complex model of environmental tolerance, where energy limitation constrains biogeographic range, and facilitate the incorporation of hydrostatic pressure into the broader metabolic framework for ecology and evolution. Such an approach is crucial for accurately projecting biogeographic responses to changing climate, and for understanding the ecology and evolution of life at depth.",2017,10.1242/jeb.158543,220,21,3916-3926,NA,Biogeographic range limitation; Heart rate; Metabolic theory; Respiration rate; Hydrostatic pressure; Hyperbaric physiology
article,Behavioral and metabolic contributions to thermoregulation in freely swimming leatherback turtles at high latitudes,"Casey, James P. and James, Michael C. and Williard, Amanda S.",JOURNAL OF EXPERIMENTAL BIOLOGY,"Leatherback turtles in the Northwest Atlantic Ocean have a broad geographic range that extends from nesting beaches near the equator to seasonal foraging grounds as far north as Canada. The ability of leatherbacks to maintain core body temperature (T-b) higher than that of the surrounding water is thought to be a key element of their biology that permits them to exploit productive waters at high latitudes. We provide the first recordings of T-b from freely swimming leatherbacks at a northern foraging ground, and use these data to assess the importance of behavioral adjustments and metabolic sources of heat for maintenance of the thermal gradient (T-g). The mean T-b for individual leatherbacks ranged from 25.4 +/- 1.7 to 27.3 +/- 0.3 degrees C, and T-g ranged from 10.7 +/- 2.4 to 12.1 +/- 1.7 degrees C. Variation in mean T-b was best explained by the amount of time that turtles spent in the relatively warm surface waters. A diel trend in T-b was apparent, with daytime cooling suggestive of prey ingestion and night- time warming attributable to endogenous heat production. We estimate that metabolic rates necessary to support the observed T-g are -3 times higher than resting metabolic rate, and that specific dynamic action is an important source of heat for foraging leatherbacks.",2014,10.1242/jeb.100347,217,13,2331-2337,NA,Endothermy; Dermochelys coriacea; Jellyfish; Diving; Reptile; Specific dynamic action
article,Hormetic benefits of prior anoxia exposure in buffering anoxia stress in a soil-pupating insect,"Visser, Bertanne and Williams, Caroline M. and Hahn, Daniel A. and Short, Clancy A. and Lopez-Martinez, Giancarlo",JOURNAL OF EXPERIMENTAL BIOLOGY,"Oxygen is essential for most animals, and exposure to a complete lack of oxygen, i.e. anoxia, can result in irreparable damage to cells that can extend up to the organismal level to negatively affect performance. Although it is known that brief anoxia exposure may confer cross-tolerance to other stressors, few data exist on the biochemical and organismal consequences of repeated intermittent bouts of anoxia exposure. In nature, the Caribbean fruit fly, Anastrepha suspensa (Diptera: Tephritidae), is frequently exposed to heavy tropical rainfall while pupating in the soil, equating to multiple exposures to hypoxia or anoxia during development. Here, we tested whether prior anoxia exposures during pupal development can induce a beneficial acclimation response, and we explored the consequences of prior exposure for both whole-organism performance and correlated biochemical metrics. Pharate adults (the last developmental stage in the pupal case) were most sensitive to anoxia exposure, showing decreased survival and fertility compared with controls. These negative impacts were ameliorated by exposure to anoxia in earlier pupal developmental stages, indicating a hormetic effect of prior anoxia exposure. Anoxia exposure early in pupal development reduced the oxygen debt repaid after anoxia exposure relative to pharate adults experiencing anoxia for the first time. Lipid levels were highest in all pupal stages when exposed to prior anoxia. Prior anoxia thus benefits organismal performance and relocates resources towards lipid storage throughout pupal-adult development.",2018,10.1242/jeb.167825,221,6,NA,jeb167825,Antioxidants; Fruit fly; Hormesis; Hypoxia; Metabolism; Oxidative stress
article,The unusual eyes of <i>Xenos</i> <i>peckii</i> (Strepsiptera: Xenidae) have green- and UV-sensitive photoreceptors,"James, Marisano and Nandamuri, Pratima and Stahl, Aaron and Buschbeck, Elke K.",JOURNAL OF EXPERIMENTAL BIOLOGY,"The highly specialized evolution of Strepsiptera has produced one of the most unusual eyes among mature insects, perhaps in line with their extremely complex and challenging life cycle. This relatively rare insect order is one of the few for which it has been unclear what spectral classes of photoreceptors any of its members may possess, an even more apt question given the nocturnal evolution of the group. To address this question, we performed electroretinograms on adult male Xenos peckii: we measured spectral responses to equi-quantal monochromatic light flashes of different wavelengths, and established VlogI relationships to calculate spectral sensitivities. Based on opsin template fits, we found maximal spectral sensitivity (lambda(max)) in the green domain at 539 nm. Application of a green light to `bleach' green receptors revealed that a UV peak was contributed to by an independent UV opsin with a lambda(max) of 346 nm. Transcriptomics and a phylogenetic analysis including 50 other opsin sequences further confirmed the presence of these two opsin classes. While these findings do not necessarily indicate that these unorthodox insects have color vision, they raise the possibility that UV vision plays an important role in the ability of X. peckii males to find the very cryptic strepsipteran females that are situated within their wasp hosts.",2016,10.1242/jeb.148361,219,24,3866-3874,NA,Invertebrate vision; Color vision; Spectral sensitivity
article,"Oxidative stress, photodamage and the role of screening pigments in insect eyes","Insausti, Teresita C. and Le Gall, Marion and Lazzari, Claudio R.",JOURNAL OF EXPERIMENTAL BIOLOGY,"Using red-eyed mutant triatomine bugs (Hemiptera: Reduvidae), we tested the hypothesis of an alternative function of insect screening pigments against oxidative stress. To test our hypothesis, we studied the morphological and physiological changes associated with the mutation. We found that wild-type eyes possess a great amount of brown and red screening pigment inside the primary and secondary pigment cells as well as in the retinular cells. Red-eyed mutants, however, have only scarce red granules inside the pigmentary cells. We then compared the visual sensitivity of red-eyed mutants and wild types by measuring the photonegative responses of insects reared in light: dark cycles {[}12. h: 12. h light: dark (LD)] or constant darkness (DD). Finally, we analyzed both the impact of oxidative stress associated with blood ingestion and photodamage of UV light on the eye retina. We found that red-eyed mutants reared in DD conditions were the most sensitive to the light intensities tested. Retinae of LD-reared mutants were gradually damaged over the life cycle, while for DD-reared insects retinae were conserved intact. No retinal damage was observed in non-fed mutants exposed to UV light for 2. weeks, whereas insects fed on blood prior to UV exposure showed clear signs of retinal damage. Wild-type insects exposed to UV light showed a marked increase in the amount and density of screening pigments.",2013,10.1242/jeb.082818,216,17,3200-3207,NA,compound eyes; ocelli; ommochromes; hematophagy; mutants
article,High fatty acid oxidation capacity and phosphorylation control despite elevated leak and reduced respiratory capacity in northern elephant seal muscle mitochondria,"Chicco, Adam J. and Le, Catherine H. and Schlater, Amber and Nguyen, Alex and Kaye, Spencer and Beals, Joseph W. and Scalzo, Rebecca L. and Bell, Christopher and Gnaiger, Erich and Costa, Daniel P. and Crocker, Daniel E. and Kanatous, Shane B.",JOURNAL OF EXPERIMENTAL BIOLOGY,"Northern elephant seals (Mirounga angustirostris) are extreme, hypoxia-adapted endotherms that rely largely on aerobic metabolism during extended breath-hold dives in near-freezing water temperatures. While many aspects of their physiology have been characterized to account for these remarkable feats, the contribution of adaptations in the aerobic powerhouses of muscle cells, the mitochondria, are unknown. In the present study, the ontogeny and comparative physiology of elephant seal muscle mitochondrial respiratory function was investigated under a variety of substrate conditions and respiratory states. Intact mitochondrial networks were studied by high-resolution respirometry in saponin-permeabilized fiber bundles obtained from primary swimming muscles of pup, juvenile and adult seals, and compared with fibers from adult human vastus lateralis. Results indicate that seal muscle maintains a high capacity for fatty acid oxidation despite a progressive decrease in total respiratory capacity as animals mature from pups to adults. This is explained by a progressive increase in phosphorylation control and fatty acid utilization over pyruvate in adult seals compared with humans and seal pups. Interestingly, despite higher indices of oxidative phosphorylation efficiency, juvenile and adult seals also exhibit a similar to 50\% greater capacity for respiratory `leak' compared with humans and seal pups. The ontogeny of this phenotype suggests it is an adaptation of muscle to the prolonged breath-hold exercise and highly variable ambient temperatures experienced by mature elephant seals. These studies highlight the remarkable plasticity of mammalian mitochondria to meet the demands for both efficient ATP production and endothermy in a cold, oxygen-limited environment.",2014,10.1242/jeb.105916,217,16,2947-2955,NA,Mitochondria; Adaptive thermogenesis; Diving mammals; Hypoxia adaptations
article,Increased fat catabolism sustains water balance during fasting in zebra finches,"Rutkowska, Joanna and Sadowska, Edyta T. and Cichon, Mariusz and Bauchinger, Ulf",JOURNAL OF EXPERIMENTAL BIOLOGY,"Patterns of physiological flexibility in response to fasting are well established, but much less is known about the contribution of water deprivation to the observed effects. We investigated body composition and energy and water budget in three groups of zebra finches: birds with access to food and water, food-deprived birds having access to drinking water and food-and-water-deprived birds. Animals were not stimulated by elevated energy expenditure and they were in thermoneutral conditions; thus, based on previous studies, water balance of fasting birds was expected to be maintained by increased catabolism of proteins. In contrast to this expectation, we found that access to water did not prevent reduction of proteinaceous tissue, but it saved fat reserves of the fasting birds. Thus, water balance of birds fasting without access to water seemed to be maintained by elevated fat catabolism, which generated 6 times more metabolic water compared with that in birds that had access to water. Therefore, we revise currently established views and propose fat to serve as the primary source for metabolic water production. Previously assumed increased protein breakdown for maintenance of water budget would occur if fat stores were depleted or if fat catabolism reached its upper limits due to high energy demands.",2016,10.1242/jeb.138966,219,17,2623-2628,NA,Protein sparing; Metabolic water; Body composition; Energy budget; Taeniopygia guttata
article,No experimental evidence of stress-induced hyperthermia in zebrafish (<i>Danio rerio</i>),"Jones, Nick A. R. and Mendo, Tania and Broell, Franziska and Webster, Mike M.",JOURNAL OF EXPERIMENTAL BIOLOGY,"Stress-induced hyperthermia (SIH) is characterised by a rise in body temperature in response to a stressor. In endotherms, SIH is mediated by the autonomic nervous system, whereas ectotherms must raise their body temperature via behavioural means by moving to warmer areas within their environment (behavioural thermoregulation). A recent study suggested that zebrafish (Danio rerio), an important model species, may move to warmer water in response to handling and confinement and thus exhibit SIH, which, if accepted, may have important practical and welfare implications. However, an alternative hypothesis proposed that the observed movements may be produced by avoidance behaviour rather than behavioural thermoregulation. Investigating the claims for SIH in zebrafish further, we conducted two experiments that extend the earlier study. The first experiment incorporated new conditions that considered fish behaviour in the absence of thermal variation, i.e. their null distribution, an important condition that was not performed in the original study. The second was a refined version of the experiment to reduce the numbers of fish and aid movement between areas for the fish. In contrast to the previous study, we saw no effect of handling or confinement on preference for warmer areas, and no evidence for SIH in either experiment. Instead, we observed a short-lived reduction in preference for warmer areas immediately post-stress. Our work suggests that zebrafish may not experience SIH, and claims regarding fish consciousness based on SIH may need to be revised.",2019,10.1242/jeb.192971,222,2,NA,jeb192971,Thermal preference; Fish welfare; Emotional fever; Fish stress; Behavioural thermoregulation; Ectotherm thermoregulation
article,Kleptoplast photoacclimation state modulates the photobehaviour of the solar-powered sea slug <i>Elysia viridis</i>,"Cartaxana, Paulo and Morelli, Luca and Quintaneiro, Carla and Calado, Goncalo and Calado, Ricardo and Cruz, Sonia",JOURNAL OF EXPERIMENTAL BIOLOGY,"Some sacoglossan sea slugs incorporate intracellular functional algal chloroplasts (kleptoplasty) for periods ranging from a few days to several months. Whether this association modulates the photobehaviour of solar-powered sea slugs is unknown. In this study, the long-term kleptoplast retention species Elysia viridis showed avoidance of dark independently of light acclimation state. In contrast, Placida dendritica, which shows non-functional retention of kleptoplasts, showed no preference over dark, low or high light. High light-acclimated (HLac) E. viridis showed a higher preference for high light than low light-acclimated (LLac) conspecifics. The position of the lateral folds (parapodia) was modulated by irradiance, with increasing light levels leading to a closure of parapodia and protection of kleptoplasts from high light exposure. Furthermore, closure of parapodia occurred at higher irradiance in HLac E. viridis. Our results strongly indicate that kleptoplast photoacclimation state modulates the photobehaviour of the solar-powered sea slug E. viridis.",2018,10.1242/jeb.180463,221,12,NA,jeb180463,Kleptoplasty; Light preference; Parapodia; Photoprotection; Sacoglossa
article,Through the looking glass: attempting to predict future opportunities and challenges in experimental biology,"Gilmour, Kathleen M. and Daley, Monica A. and Egginton, Stuart and Kelber, Almut and Mchenry, Matthew J. and Patek, Sheila N. and Sane, Sanjay P. and Schulte, Patricia M. and Terblanche, John S. and Wright, Patricia A. and Franklin, Craig E.",JOURNAL OF EXPERIMENTAL BIOLOGY,"To celebrate its centenary year, Journal of Experimental Biology (JEB) commissioned a collection of articles examining the past, present and future of experimental biology. This Commentary closes the collection by considering the important research opportunities and challenges that await us in the future. We expect that researchers will harness the power of technological advances, such as `-omics' and gene editing, to probe resistance and resilience to environmental change as well as other organismal responses. The capacity to handle large data sets will allow high-resolution data to be collected for individual animals and to understand population, species and community responses. The availability of large data sets will also place greater emphasis on approaches such as modeling and simulations. Finally, the increasing sophistication of biologgers will allow more comprehensive data to be collected for individual animals in the wild. Collectively, these approaches will provide an unprecedented understanding of `how animals work' as well as keys to safeguarding animals at a time when anthropogenic activities are degrading the natural environment.",2023,10.1242/jeb.246921,226,24,NA,jeb246921,Biologgers; Genomics; Bioengineering; Modeling; Simulations; Field physiology; Individual variation
article,Why do ants differ in acclimatory ability? Biophysical mechanisms behind cuticular hydrocarbon acclimation across species,"Baumgart, Lucas and Wittke, Marti and Morsbach, Svenja and Abou, Berengere and Menzel, Florian",JOURNAL OF EXPERIMENTAL BIOLOGY,"Maintaining water balance is vital for terrestrial organisms. Insects protect themselves against desiccation via cuticular hydrocarbons (CHCs). CHC layers are complex mixtures of solid and liquid hydrocarbons, with a surprisingly diverse composition across species. This variation may translate into differential phase behaviour, and hence varying waterproofing capacity. This is especially relevant when temperatures change, which requires acclimatory CHC changes to maintain waterproofing. Nevertheless, the physical consequences of CHC variation are still little understood. We studied acclimatory responses and their consequences for CHC composition, phase behaviour and drought survival in three congeneric ant species. Colony sub-groups were kept under cool, warm and fluctuating temperature regimes. Lasius niger and Lasius platythorax, both of which are rich in methyl-branched alkanes, showed largely predictable acclimatory changes of the CHC profile. In both species, warm acclimation increased drought resistance. Warm acclimation increased the proportion of solid compounds in L. niger but not in L. platythorax. In both species, the CHC layer formed a liquid matrix of constantly low viscosity, which contained highly viscous and solid parts. This phase heterogeneity may be adaptive, increasing robustness to temperature fluctuations. In Lasius brunneus, which is rich in unsaturated hydrocarbons, acclimatory CHC changes were less predictable, and warm acclimation did not enhance drought survival. The CHC layer was more homogeneous, but matrix viscosity changed with acclimation. We showed that ant species use different physical mechanisms to enhance waterproofing during acclimation. Hence, the ability to acclimate, and thus climatic niche breadth, may strongly depend on species-specific CHC profile.",2022,10.1242/jeb.243847,225,16,NA,jeb243847,Climate adaptation; Cuticular hydrocarbons; Ecological niche breadth; Phase behaviour; Microrheology; Drought tolerance
